time,symbol,title
2024-10-25,MBB,"MBB: Ms. Vu Thai Huyen - Member of the Board of Directors registered to receive transfer of 171,900 shares"
2024-10-25,MBB,MBB: Mr. Do Van Tien - Member of the Supervisory Board registered to transfer 7.650 shares
2024-10-25,MBB,"MBB: Mr. Le Xuan Vu - Member of the Board of Directors registered to receive transfer of 85,400 shares"
2024-10-25,MBB,"MBB: Ms. Nguyen Thi Nguyet Ha - Member of the Supervisory Board registered to transfer 27,202 shares"
2024-10-25,MBB,"MBB: Ms. Do Thi Tuyet Mai - Member of the Supervisory Board registered to transfer 62,200 shares"
2024-10-25,MBB,"MBB: Mr. Nguyen Ngoc Thanh - In charge of admission to register for transfer 3,105 shares"
2024-10-25,MBB,"MBB: MBB grassroots trade union registered transfer 6,329,996 shares"
2024-10-18,MBB,MBB: The Board of Directors approved the transaction contract with OceanBank
2024-10-18,MBB,MBB: The Board of Directors approved OceanBank transfer
2024-10-18,MBB,MBB: The Board of Directors approved the transaction contract between MB and Viettel
2024-10-16,MBB,MBB: CBTT established Dak Nong Branch
2024-10-16,MBB,MBB: CBTT established Cao Bang Branch
2024-10-03,MBB,MBB: Resolution of the Board of Directors on the issuance of additional bonds for sale 2024-2025
2024-10-03,MBB,MBB: The Board's decision on changing the location of Pleiku Transaction Office
2024-10-02,MBB,"MBS: Military Commercial Joint Stock Bank bought 1,154,471 shares"
2024-10-02,MBB,MBB: Official Letter of the SSC on the report on the implementation of the 2nd public bond offering of MBB
2024-09-30,MBB,MBB: The decision of the Board of Directors on the establishment of Kon Tum Branch
2024-09-30,MBB,MBB: Decision of the Board of Directors on the establishment of Hoai Nhon Transaction Office
2024-09-25,MBB,"MBS: Military Commercial Joint Stock Bank registered to buy 1,154,471 shares"
2024-09-20,MBB,MBB: The decision of the Board of Directors on changing the location of Yen Bai branch
2024-09-20,MBB,MBB: The decision of the Board of Directors on changing the location and name of PGD to Nam
2024-09-18,MBB,"MBB: MBB grassroots trade union has received 3,237 shares"
2024-09-16,MBB,MBB: The decision of the Board of Directors on the establishment of Nam Binh Thuan Transaction Office
2024-09-16,MBB,MBB: The decision of the Board of Directors on the establishment of Sa Dec Transaction Office
2024-09-16,MBB,MBB: The decision of the Board of Directors on the establishment
2024-09-16,MBB,MBB: The decision of the Board of Directors on changing the location of Yen Lac Transaction Office
2024-09-11,MBB,MBB: The decision of the Board of Directors on the establishment of Quoc Oai Transaction Office
2024-09-11,MBB,MBB: Decision of the Board of Directors on changing the location of the transaction office in District 8
2024-09-06,MBB,MBB: Notice of changing the location of Dong Anh Branch
2024-09-06,MBB,MBB: CBTT changes the location of Dong Saigon branch
2024-08-30,MBB,"Announcing the top 20 banks to submit the largest budget on the list of VNTAX 200: including the State, private and foreign blocks"
2024-08-30,MBB,MBB: CBTT The plan to exercise the right to buy shares to increase charter capital in 2024
2024-08-27,MBB,MBB: The decision of the Board of Directors on changing the location of Luc Nam Transaction Office
2024-08-27,MBB,"MBB: MBB grassroots trade union registered to receive transfer of 3,238 shares"
2024-08-23,MBB,"MBB: Report on stock trading results of internal people, related people"
2024-08-21,MBB,"MBB: Notice of changing location, name and branch management branch Ly Thai To"
2024-08-20,MBB,MBB: Decision of the Board of Directors on changing the location and name of the transaction office from Son directly under Bac Ninh Branch
2024-08-19,MBB,"MBB: Mr. Le Viet Hai - Member of the Board of Directors sold 456,000 shares"
2024-08-16,MBB,MBB: The decision of the Board of Directors on changing the location and name of Nam Ky Khoi Nghia transaction office under Vung Tau Branch
2024-08-14,MBB,JPMorgan owns over 1% of capital at MB
2024-08-14,MBB,MBB: The decision of the Board of Directors on changing the location of Saigon Branch
2024-08-14,MBB,MBB: Decision of the Board of Directors on changing the location of Chi Linh Transaction Office
2024-08-14,MBB,MBB: The decision of the Board of Directors on the establishment of a branch from Son and renamed it to Kinh Bac branch
2024-08-08,MBB,"MBB: Mr. Le Viet Hai - Member of the Board of Directors registered to sell 456,000 shares"
2024-08-05,MBB,"MBB: Notice of stock transactions of internal people, related people"
2024-07-31,MBB,MBB: Report on the company management situation in the first 6 months of 2024
2024-07-30,MBB,MBB: MBB grassroots trade union has not yet received CP transfer
2024-07-29,MBB,MBB: Appointing Mr. Nguyen Ngoc Thanh in charge of management and company secretary from 25.7.2024
2024-07-26,MBB,"MBB: MBB grassroots trade union registered to receive transfer of 3,237 shares"
2024-07-23,MBB,MBB: CBTT The capital representative of Vietnam helicopter Corporation at MBB
2024-07-12,MBB,MBB: The decision of the Board of Directors on the establishment of Can Giuoc PGD under Long An Branch
2024-07-12,MBB,MBB: The decision of the Board of Directors on the establishment of Song Cau Transaction Office under Phu Yen Branch
2024-07-09,MBB,"MBB: Mrs. Nguyen Thi Nguyet Ha's sister - member of the Supervisory Board sold 200,000 shares"
2024-07-05,MBB,MBB: Notice of changing Viettel's capital representative at MBB
2024-07-03,MBB,"MBB: Mrs. Nguyen Thi Nguyet Ha - Member of the Supervisory Board registered for sale 200,000 shares"
2024-07-02,MBB,MBB: Additional notice of internal people
2024-07-02,MBB,MBB: Appointing Mr. Nguyen Xuan Hoc as Deputy General Director from 2.7.2024
2024-06-28,MBB,MBB: Resolution of the Board of Directors on promulgating the Regulation on organization and operation of the Supervisory Board
2024-06-28,MBB,MBB: Organization and operation regulations of the BKS
2024-06-28,MBB,MBB: Decision of the Board of Directors on changing the location and name of My Tho Transaction Office
2024-06-28,MBB,"MBB: Official Letter of CBTT promulgates the Charter, Regulation on the State Administration, Regulation on organization and operation of the Board of Directors"
2024-06-28,MBB,MBB: Company Charter 2024
2024-06-28,MBB,MBB: Organization and operation regulations of the Board of Directors
2024-06-28,MBB,"MBB: Resolution of the Board of Directors promulgating the Charter, Regulation on the State Administration, the Regulation on organization and operation of the Board of Directors"
2024-06-28,MBB,MBB: Company Internal Administration Regulations
2024-06-25,MBB,MBB: Notice the capital representative of Tan Cang at MBB
2024-06-18,MBB,MBB: CBTT about SCIC's capital representative at MBB
2024-06-17,MBB,MBB: The Resolution of the Extraordinary General Meeting of Shareholders in 2024
2024-06-17,MBB,MBB: Meeting minutes and resolutions of the Extraordinary General Meeting of Shareholders in 2024
2024-06-17,MBB,MBB: Notice of change of personnel for term 2024 - 2029
2024-06-17,MBB,"MBB: Resolution of the Board of Directors on the election of Chairman, Vice Chairman of the Board of Directors"
2024-06-17,MBB,MBB: Resolution of the Supervisory Board on the election of the Supervisory Board and the Deputy Head of the Supervisory Board
2024-06-17,MBB,MBB: Minutes of the Extraordinary General Meeting of Shareholders in 2024
2024-06-13,MBB,"MBB: The number of voting shares is circulating is 5,306,324,052 shares"
2024-06-13,MBB,"MBB: Published 19,240,000 shares Esop"
2024-06-13,MBB,MBB: Resolution of the Board of Directors on the approval of a contract between MBB and Viettel
2024-06-10,MBB,MBB: Notice of tax test results
2024-06-10,MBB,"MBB: Mr. Le Quoc Minh - Deputy General Director bought 24,000 shares"
2024-06-10,MBB,"MBB: Mrs. Do Thi Tuyet Mai - a member of the Supervisory Board bought 65,000 shares"
2024-06-10,MBB,"MBB: Mr. Ha Trong Khiem - Deputy General Director bought 21,600 shares"
2024-06-10,MBB,"MBB: Ms. Nguyen Thi Thanh Nga - Financial Director bought 286,000 shares"
2024-06-10,MBB,"MBB: Ms. Do Thi Tuyet Mai - Member of the Supervisory Board bought 64,000 shares"
2024-06-10,MBB,"MBB: Mr. Le Quoc Minh - Deputy General Director bought 238,000 shares"
2024-06-10,MBB,"MBB: Mr. Do Van Hung - Member of the Supervisory Board bought 64,000 shares"
2024-06-10,MBB,"MBB: Ms. Do Kim Loan - Management in charge bought 172,975 shares"
2024-06-10,MBB,"MBB: Mr. Tran Minh Dat - Deputy General Director bought 343,000 shares"
2024-06-10,MBB,"MBB: Ms. Nguyen Thi An Binh - Deputy Head of Supervisory Board bought 122,000 shares"
2024-06-10,MBB,"MBB: Ms. Dang Thuy Dung - Chief Accountant bought 75,000 shares"
2024-06-10,MBB,"MBB: Ms. Le Thi Loi - Head of the Supervisory Board bought 235,000 shares"
2024-06-10,MBB,"MBB: Ms. Pham Thi Trung Ha - Deputy General Director bought 357,000 shares"
2024-06-10,MBB,"MBB: Mr. Ha Trong Khiem - Deputy General Director bought 208,000 shares"
2024-06-10,MBB,"MBB: Ms. Nguyen Minh Chau - Deputy General Director bought 286,000 shares"
2024-06-10,MBB,"MBB: Mr. Pham Nhu Anh - General Director bought 547,000 shares"
2024-06-10,MBB,"MBB: MBB grassroots trade union received 12,689 shares"
2024-06-05,MBB,"MBB: Notice of changing location of Tan Uyen Transaction Office, Uyen Hung Transaction Office, Ben Cat Transaction Office - Binh Duong Branch"
2024-06-05,MBB,MBB: Continuing to appoint Mr. Ha Trong Khiem as Deputy General Director and Director of Branch of Transaction Office 2
2024-06-05,MBB,MBB: Notice of transfer of capital contribution of the Corporation Company Limited 28
2024-06-03,MBB,MBB: Rules of amendment company
2024-06-03,MBB,MBB: The Resolution of the Board of Directors approves the regular bond issuance plan issued by MB in the form of a separate offering
2024-05-30,MBB,MBB: Notice of stock issuance according to the selection program for employees in the company
2024-05-30,MBB,"MBB: Notice of trading right to buy stocks of internal people Le Thi Loi, Nguyen Thi An Binh, Do Van Hung, Do Thi Tuyet Mai"
2024-05-30,MBB,"MBB: Notice of trading rights to buy stocks of internal people Pham Nhu Anh, Tran Minh Dat, Pham Thi Trung Ha, Nguyen Minh Chau"
2024-05-30,MBB,"MBB: Notice of trading rights to buy stocks of Hanoi people Ha Trong Khiem, Le Quoc Minh, Do Kim Loan, Nguyen Thi Thanh Nga"
2024-05-30,MBB,"MBB: Notice of trading transactions to buy stocks of internal people Dang Thuy Dung, Nguyen Hai, Ha Trong Khoa, Le Quoc Dung"
2024-05-29,MBB,MBB: CBTT received a letter from the SSC on receiving the issuing dossier of ESOP shares
2024-05-27,MBB,"MB broke up with 6 members of the Board of Directors, elected 7 people, the youngest person this year 37 years old"
2024-05-27,MBB,MB prepares meeting with the General Meeting of Shareholders for the term 2024 - 2029
2024-05-27,MBB,MBB: Notice of invitation to the 2024 Annual General Meeting of Shareholders and the path to see the document
2024-05-27,MBB,MBB: Notice of the DKC day paying dividends in money
2024-05-21,MBB,"MBB: MBB grassroots trade union registered to receive transfer of 12,689 shares"
2024-05-21,MBB,"MBB: MBB grassroots trade union has received 28,304 shares transfer"
2024-05-20,MBB,MBB: Notice of change of the 54th Certificate
2024-05-20,MBB,MBB: Resolution of the Board of Directors approving telecommunications service contracts with DVS
2024-05-17,MBB,"MBB: 23.5.2024, Date of Education and Training in 2023 in cash (500 VND/share)"
2024-05-17,MBB,"MBB: 14.3.2029, trading 73,000,000 additional listed shares"
2024-05-14,MBB,"MBB: 23.5.2024, Date of Education and Education attended the extraordinary shareholder meeting in 2024"
2024-05-14,MBB,"MBB: 15.5.2024, posted additional 73,000,000 shares"
2024-05-13,MBB,MBB: CBTT closed the list of shareholders receiving cash dividends
2024-05-08,MBB,"MBB: MBB grassroots trade union registered to receive transfer of 28,304 shares"
2024-05-07,MBB,"MBB: MBB grassroots trade union has received 9,930 shares"
2024-05-06,MBB,MBB: The Board of Directors approved the plan to organize the annual shareholder meeting of 2024
2024-05-06,MBB,MBB: Resolution of the Board of Directors approving a contract to implement chatbot solution between MB and Viettel
2024-05-06,MBB,MBB: CBTT modified the establishment and operation license of MB
2024-04-25,MBB,"MBB: Notice of changes in name, location and management of Tan Trieu Transaction Office"
2024-04-22,MBB,Why does MB's 1 -20024 profit decline compared to the same period?
2024-04-22,MBB,MBB: Resolution of the General Meeting of Shareholders on the amendment and supplementation
2024-04-22,MBB,MBB: Minutes of the annual General Meeting of Shareholders 2024
2024-04-22,MBB,MBB: Resolution of the General Meeting of Shareholders on the amendment and supplementation of the Regulation on organizational and operation of the Supervisory Board
2024-04-22,MBB,MBB: Resolution of the General Meeting of Shareholders on the amendment and supplementation
2024-04-22,MBB,MBB: Resolution of the General Meeting of Shareholders on voting through issues at the 2024 Annual General Meeting of Shareholders
2024-04-22,MBB,MBB: Resolution of the General Meeting of Shareholders on the approval of the use of equity 2024
2024-04-22,MBB,MBB: Resolution of the General Meeting of Shareholders on the approval of the plan to increase the charter capital
2024-04-22,MBB,MBB: Resolution of the General Meeting of Shareholders approving the financial statements in 2023 auditing and profit distribution plan 2023
2024-04-22,MBB,MBB: Resolution of the Board of Directors on ESOP distribution plan
2024-04-19,MBB,"MBH: The plan of growth 2024 is cautious, safe, dividend in the rate of 20%, shareholders question a series of ""hot"" issues."
2024-04-19,MBB,"MB MNT: Each shareholder receives 500,000 VND, is expected to 1,600 attendees"
2024-04-15,MBB,MB President Luu Trung Thai: MB aims at 30 million customers in 2024
2024-04-04,MBB,MBB: MBB grassroots trade union has not yet received CP transfer
2024-04-04,MBB,"MBB: MBB grassroots trade union registered to receive transfer of 9,930 shares"
2024-04-01,MBB,"MB announced a plan to divide cash dividends, expected to become the next bank in the history of the Big4 group"
2024-04-01,MBB,MBB: CBTT DOCUMENTATION DOCUMENTS Meeting of the annual General Meeting of Shareholders in 2024
2024-03-26,MBB,MBB: Notice of signing audit contracts 2024
2024-03-22,MBB,"MBB: Pyn Elite Fund (Non -Ucits) - CDL bought 720,000 shares"
2024-03-19,MBB,"MBB: Military Industry - Telecommunications Group bought 43,000,000 shares"
2024-03-19,MBB,"MBB: Corporation for State Capital Investment and Business (SCIC) has bought 30,000,000 shares"
2024-03-18,MBB,"MBB: The number of voting shares is circulating is 5,287,084.052 shares"
2024-03-18,MBB,"MBB: issued 73,000,000 individual shares"
2024-03-15,MBB,SCIC's subsidiary has matched all MBB shares held
2024-03-15,MBB,"MBB: SCIC Investment One Member Company Limited (SIS) has sold 1,350,000 shares"
2024-03-08,MBB,"Boss MB: ""MB people said to do, did it was equal"""
2024-03-08,MBB,MBB: Report on capital safety ratio at December 31.2023
2024-03-07,MBB,"MBB: Military Industry - Telecommunications Group registered to buy 43,000,000 shares"
2024-03-06,MBB,SCIC cost 480 billion dong to buy 30 million shares MB
2024-03-06,MBB,"President Luu Trung Thai: Credit balance with Novaland is ranked in group 1, revealing credit relationship with VinFast"
2024-03-05,MBB,"MBB: State Corporation for Investment and Business (SCIC) registered to buy 30,000,000 shares"
2024-03-04,MBB,MBB: The Resolution of the Board of Directors approved the plan to repay the capital collected from the public offering in the public in 2024
2024-03-04,MBB,MBB: Resolution of the Board of Directors approving the registration dossier for the public bonds in 2024
2024-02-28,MBB,"MBB: MBB grassroots trade union registered to receive transfer of 9,930 shares"
2024-02-19,MBB,SCIC investment wants all capital in MB
2024-02-16,MBB,SCIC's subsidiary wants to sell all MB shares holding
2024-02-15,MBB,"MBB: SCIC Investment One Member Company Limited (SIC) has sold 1,650,000 shares"
2024-02-15,MBB,"MBB: SCIC Investment One Member Company Limited (SIS) registered for 1,350,000 shares"
2024-01-31,MBB,MBB: Report on the company management situation in 2023
2024-01-30,MBB,"The ratio of deposits is up to 40.1% in 2023, MB maintains the championship for the second consecutive CASA"
2024-01-30,MBB,"MB prepares shareholder meeting to discuss the plan of profit distribution, capital increase, ..."
2024-01-30,MBB,MB offered 73 million shares for Viettel and SCIC
2024-01-29,MBB,MBB: Notice of inviting the annual General Meeting of Shareholders in 2024
2024-01-29,MBB,MBB: Resolution of the Board of Directors on the issuance of individual shares
2024-01-19,MBB,"MBB: Notice of bachelor's scheme expected to elect the Board of Directors, the Supervisory Board for the term 2024-2029"
2024-01-17,MBB,"MBB: MBB grassroots trade union has received 28,739 shares"
2024-01-15,MBB,"Not buying as registered, SCIC's subsidiary switched to selling all MBB shares"
2024-01-15,MBB,MBB: Notice of changing the location of Ninh Binh Branch
2024-01-15,MBB,MBB: Notice of change of name and location
2024-01-12,MBB,"MBB: 17.1.2024, Date of Education and Education attended the annual shareholder meeting in 2024 and nominated to join the Board of Directors, the Supervisory Board for the term 2024-2029"
2024-01-12,MBB,MBB: SCIC Investment One Member Limited Company has not yet bought CP
2024-01-12,MBB,"MBB: SCIC Investment One Member Limited Company registers for sale 3,000,000 shares"
2024-01-08,MBB,MBB: DKKC to exercise the right to attend the annual General Meeting of Shareholders in 2024
2024-01-03,MBB,"MBB: MBB grassroots trade union registered to receive transfer of 28,739 shares"
2024-01-02,MBB,MBB: Resolution of the Board of Directors approving the plan to organize the annual shareholder meeting of 2024
2023-12-29,MBB,MBB: The decision of the Board of Directors on changing the location of Van Lam Transaction Office
2023-12-29,MBB,MBB: The decision of the Board of Directors on changing the location of Hung Ha Transaction Office
2023-12-28,MBB,"MBB: Mrs. Nguyen Thi Thuy's sister -in -law - a member of the Board of Directors sold 98,500 shares"
2023-12-25,MBB,"MBB: MBB grassroots trade union received 32,963 shares"
2023-12-22,MBB,"MBB: SCIC Investment One Member Company Limited (SIS) registered to buy 1,380,000 shares"
2023-12-22,MBB,"MBB: Mrs. Nguyen Thi Thuy's sister -in -law - Member of the Board of Directors registered to sell 98,500 shares"
2023-12-19,MBB,MBB: Notice of changing the location of An Phu Branch
2023-12-15,MBB,BCP: Resolution of the Board of Directors approving loans at MB South Saigon
2023-12-13,MBB,MBB: Notice of changing the location of Cu Chi Branch
2023-12-13,MBB,MBB: Notice of changing the location of Dinh Tien Hoang
2023-11-30,MBB,"MBB: MBB grassroots trade union has received 31,763 shares"
2023-11-28,MBB,MBB: CBTT about the acquisition of bonds before the due date
2023-11-22,MBB,Reveal the revenue and profit of the largest businesses in Vietnam
2023-11-22,MBB,MBB: Decision on changing the name of the branch and the name of the transaction office
2023-11-21,MBB,MBB: Notice of the acquisition of bonds before the maturity of MBBL2128014
2023-11-20,MBB,MBB: Notice of changing the names of Cam Ranh and PGD branches affiliated
2023-11-20,MBB,MBB: CBTT about changing the address of Chi Linh Transaction Office - Hai Duong Branch
2023-11-17,MBB,MBB: Decision on CEO about the amendments to the terms of the issuing deposit certificate
2023-11-15,MBB,MBB: Notice of acquisition of TP before the deadline (TP code: MBBL2128013)
2023-11-07,MBB,MBB: Notice the results of the acquisition of bonds before the term of MBBL2128012
2023-11-02,MBB,MBB: CBTT results offering individual bonds MBBL2330005
2023-10-31,MBB,"Top 20 biggest profit enterprises in the market: It seems like the bank's ""private playground"", nearly half of the interest rate decreases, 1 unit growth 600%"
2023-10-30,MBB,"Military Bank (MB) increased slightly by more than VND 20,000 billion in the first 9 months, credit grew by 13.7%, with 4 million new customers."
2023-10-26,MBB,"MBB: MBB grassroots trade union has received 24,847 CP transfer"
2023-10-26,MBB,MBB: Notice of establishment of Tan Quy Transaction Office
2023-10-25,MBB,"MBB: SCIC Investment Company Limited bought 1,620,000 shares"
2023-10-19,MBB,MBB: The Board's decision on changing the location and name of Phu Xuan Transaction Office
2023-10-19,MBB,MBB: The decision of the Board of Directors on the establishment of Tan Tuc Transaction Office
2023-10-19,MBB,MBB: The decision of the Board of Directors on changing the location of Nghi Son Transaction Office
2023-10-19,MBB,MBB: Decision of the Board of Directors on changing the name of Nha Be Branch
2023-10-19,MBB,MBB: The decision of the Board of Directors on the establishment of Phu Xuan Branch
2023-10-19,MBB,MBB: The decision of the Board of Directors on the establishment of Vinh Loc Branch
2023-10-18,MBB,MBB: Announcing the acquisition of bonds before the term MBBL2128010
2023-10-18,MBB,MBB: Announcing the acquisition of bonds before the term of MBBL2128012
2023-10-12,MBB,"MBB: MBB grassroots trade union registered to receive transfer 24,847 shares"
2023-10-09,MBB,"MBB: CBTT under the pillar of 3 Basel II at June 30, 2023"
2023-10-06,MBB,MBB: Notice the results of the individual bond offer
2023-10-06,MBB,MBB: Results of acquisition of bonds before the due date
2023-10-06,MBB,MBB: Notice of changing the location of Soc Son Transaction Office
2023-10-06,MBB,MBB: Notice of changing the location of Chon Thanh PG
2023-10-02,MBB,MBB: Notice of changing the location of Bao Loc branch
2023-10-02,MBB,MBB: Results of acquisition of bonds before the due date
2023-09-28,MBB,MBB: Results of individual bonds offer
2023-09-27,MBB,SCIC wants to buy an additional 3 million MBB shares
2023-09-21,MBB,MBB: CBTT decided the Board of Directors on the establishment of Ben Luc Transaction Office
2023-09-21,MBB,MBB: CBTT decided the Board of Directors to establish Ninh Thuan Branch
2023-09-21,MBB,MBB: CBTT decided the Board of Directors to establish Dien Bien Branch
2023-09-21,MBB,"MBB: SCIC registered to buy 3,000,000 shares"
2023-09-21,MBB,MBB: Establishment of Bac Lieu Branch
2023-09-20,MBB,MBB: CBTT about the acquisition of bonds
2023-09-12,MBB,MBB: Change the name and location of Tran Hung Dao Transaction Office
2023-09-07,MBB,"MBB: MBB grassroots trade union registered to receive 44,550 shares"
2023-09-06,MBB,MBB: Amendment of the Charter of 2023
2023-09-05,MBB,MBB: Establishing Chon Thanh Transaction Office
2023-08-31,MBB,"MBB: Mrs. Nguyen Thi Thuy's sister -in -law - Member of the Board of Directors registered for sale 35,500 shares"
2023-08-25,MBB,MBB: 53rd business registration certificate
2023-08-24,MBB,MBB: Change the address of An Giang CN
2023-08-23,MBB,"Opportunity to ""hunt"" Phu Quy gifts with MB"
2023-08-23,MBB,"MBB: Change the names of PGD Mo Duc, Binh Son, Xa Mat"
2023-08-22,MBB,MB power for businesses to grow stable and safe credit
2023-08-18,MBB,"Chairman of the Board of Directors MB: ""The digital platform will account for about 50% of the revenue"""
2023-08-17,MBB,"MBB: 29.8.2023, trading 680,097,919 additional listing"
2023-08-16,MBB,MBB: Change the content of charter capital in the GPDKD
2023-08-14,MBB,"When the saving channel is no longer suitable, what is the current investment trend?"
2023-08-11,MBB,"MBB: 14.8.2023, additional listing 680,097,919 shares"
2023-08-09,MBB,The imprint of building a green bank of MB Pham Nhu Anh
2023-08-08,MBB,Military Commercial Joint Stock Bank (MB) introduces Apple Pay to customers
2023-08-08,MBB,Green mark in MB - the foundation for sustainable development
2023-08-08,MBB,MBB: 17th Securities Registration Certificate
2023-08-08,MBB,MBB: Change the name and location of PGD Hoang Van Thu
2023-07-31,MBB,MBB: Report on the company management situation in the first 06 months of 2023
2023-07-31,MBB,"Casa of the Military Bank recovers in the second quarter to 37%, maintaining the championship"
2023-07-25,MBB,MBB: The decision of the Board of Directors Regarding the change of location and name of Tan Hiep Transaction Office
2023-07-25,MBB,MBB: Decision of the Board of Directors Regarding the change of venue for Duc Trong Transaction Office
2023-07-19,MBB,"MBB: The number of shares with voting rights is 5,214,084,052 shares"
2023-07-19,MBB,"MBB: issued 680,097,919 shares to pay dividends"
2023-07-17,MBB,General Director of MB proposed a series of difficult solutions for real estate credit
2023-07-14,MBB,"MBB: MBB grassroots trade union received 635,383 shares"
2023-07-12,MBB,"MBB: 14.7.2023, Date of Education and Education to exercise the right to pay dividends in 2022 (100: 15 ratio)"
2023-07-11,MBB,"Ticket to see how expensive Blackpink Concert Ticket in My Dinh: spent 400 new HPG shares sitting in the VIP chair, a lot of NVL only has the cheapest position"
2023-07-07,MBB,MBB: Change the name and location of PGD Le Duan
2023-07-06,MBB,"Add large banks to pay dividends in July, the rate of 15%"
2023-07-06,MBB,MBB: CBTT issued shares to pay dividends
2023-07-05,MBB,MBB: DKC DAIC PAYS Dividend by stock
2023-06-30,MBB,"MBB: Trade Union of Military Commercial Joint Stock Bank registered to transfer 635,383 shares"
2023-06-29,MBB,MBB: Change the location of Hung Vuong Transaction Office
2023-06-20,MBB,MBB: Re -appointing Ms. Pham Thuy Dung to hold the position of Chief Accountant and Deputy Director of the Block - The TC -KT block from 20.6
2023-06-16,MBB,"MBB: Mrs. Nguyen Thi Thuy's sister -in -law - TV.H?QT sold 206,000 shares"
2023-06-15,MBB,MBB: Re -appointing Ms. Pham Thi Trung Ha as Deputy General Director from June 15
